{
  "$schema": "https://json-schema.org/draft/2020-12/schema",
  "$id": "https://archlens.local/view.schema.json",
  "title": "archlens view spec",
  "type": "object",
  "required": [
    "key",
    "notation"
  ],
  "properties": {
    "key": {
      "type": "string",
      "minLength": 1
    },
    "notation": {
      "enum": [
        "c4",
        "archimate"
      ]
    },
    "title": {
      "type": "string"
    },
    "description": {
      "type": "string"
    },
    "include": {
      "type": "array",
      "items": {
        "type": "string"
      }
    },
    "exclude": {
      "type": "array",
      "items": {
        "type": "string"
      }
    },
    "layout": {
      "type": "object",
      "properties": {
        "direction": {
          "enum": [
            "RIGHT",
            "DOWN",
            "LEFT",
            "UP",
            "auto"
          ]
        },
        "aspectRatio": {
          "type": "number",
          "exclusiveMinimum": 0
        },
        "style": {
          "enum": [
            "auto",
            "flow",
            "bands",
            "bands-flow"
          ]
        }
      },
      "additionalProperties": false
    },
    "animation": {
      "enum": [
        "trace",
        "story",
        "impact",
        "layers"
      ]
    },
    "edgeLabels": {
      "type": "boolean"
    },
    "level": {
      "enum": [
        "landscape",
        "context",
        "container",
        "component",
        "dynamic"
      ]
    },
    "scope": {
      "type": "string"
    },
    "groups": {
      "description": "groupings: cut the view to their members (only, crossOnly) and draw frames",
      "type": "object",
      "additionalProperties": false,
      "properties": {
        "only": {
          "type": "array",
          "items": {
            "type": "string"
          },
          "minItems": 1
        },
        "crossOnly": {
          "type": "boolean"
        },
        "frames": {
          "type": "boolean"
        }
      }
    },
    "expand": {
      "description": "C4 container/dynamic: other software systems whose containers are also shown, each inside its own boundary",
      "type": "array",
      "items": {
        "type": "string"
      }
    },
    "focus": {
      "type": "array",
      "items": {
        "type": "string"
      }
    },
    "depth": {
      "type": "integer",
      "minimum": 0
    },
    "steps": {
      "type": "array",
      "items": {
        "type": "object",
        "properties": {
          "from": {
            "type": "string"
          },
          "to": {
            "type": "string"
          },
          "rel": {
            "type": "string"
          },
          "description": {
            "type": "string"
          },
          "technology": {
            "type": "string"
          }
        }
      }
    },
    "viewpoint": {
      "enum": [
        "business",
        "application",
        "technology",
        "strategy",
        "motivation",
        "implementation-migration",
        "application-cooperation",
        "implementation-deployment",
        "layered",
        "impact",
        "product-support",
        "custom"
      ]
    },
    "layers": {
      "type": "array",
      "items": {
        "enum": [
          "motivation",
          "strategy",
          "business",
          "application",
          "technology",
          "physical",
          "implementation",
          "other"
        ]
      }
    },
    "types": {
      "type": "array",
      "items": {
        "type": "string"
      }
    },
    "anchor": {
      "type": "string"
    },
    "traverse": {
      "type": "object",
      "additionalProperties": false,
      "properties": {
        "mode": {
          "enum": [
            "supporters",
            "dependents",
            "both"
          ]
        },
        "via": {
          "type": "array",
          "items": {
            "enum": [
              "composition",
              "aggregation",
              "assignment",
              "realization",
              "serving",
              "access",
              "influence",
              "triggering",
              "flow",
              "specialization",
              "association"
            ]
          }
        },
        "maxDepth": {
          "type": "integer",
          "minimum": 1
        },
        "hierarchy": {
          "type": "boolean"
        }
      }
    },
    "granularity": {
      "enum": [
        "component",
        "container",
        "system"
      ]
    },
    "collapse": {
      "type": "array",
      "items": {
        "type": "string"
      }
    },
    "status": {
      "description": "lifecycle statuses shown (default: all but retired)",
      "type": "array",
      "items": {
        "enum": [
          "draft",
          "planned",
          "active",
          "deprecated",
          "retired"
        ]
      }
    },
    "nesting": {
      "anyOf": [
        {
          "enum": [
            "edges",
            "nested"
          ]
        },
        {
          "type": "object",
          "additionalProperties": false,
          "required": [
            "mode"
          ],
          "properties": {
            "mode": {
              "enum": [
                "edges",
                "nested"
              ]
            },
            "depth": {
              "type": "integer",
              "minimum": 1
            },
            "except": {
              "type": "array",
              "items": {
                "type": "string"
              }
            }
          }
        }
      ]
    },
    "derive": {
      "type": "boolean"
    },
    "output": {
      "type": "array",
      "items": {
        "enum": [
          "diagram",
          "matrix"
        ]
      }
    }
  }
}
