[
  {
    "key": "impacto-pedidos",
    "notation": "archimate",
    "viewpoint": "impact",
    "anchor": "loja.pedidos",
    "title": "Impacto de Pedidos"
  },
  {
    "key": "impacto-pagamentos",
    "notation": "archimate",
    "viewpoint": "impact",
    "anchor": "ext.pagamentos",
    "title": "Impacto de Pagamentos"
  },
  {
    "key": "impacto-infra",
    "notation": "archimate",
    "viewpoint": "impact",
    "anchor": "infra-cloud",
    "title": "Impacto da Infraestrutura"
  }
]
